{
  "specversion": "1.0",
  "id": "evt-SYNTHETIC_QA_01-7-1-0",
  "source": "urn:nexoai:camera:SYNTHETIC_QA_01",
  "type": "com.nexoai.safety.ppe.violation.v1",
  "time": "2026-01-01T00:00:00.700Z",
  "datacontenttype": "application/json",
  "dataschema": "https://nexoai.example/contracts/v1/event.schema.json",
  "subject": "track/1",
  "contractversion": "1.0.0",
  "data": {
    "contract_version": "1.0.0",
    "frame_id": 7,
    "monotonic_timestamp_ms": 700,
    "track_id": 1,
    "status": "Falta Casco",
    "confidence": 0.8,
    "evidence": [{"ref": "urn:sha256:aaaaaaaaaaaaaaaaaaaaaaaaaaaaaaaaaaaaaaaaaaaaaaaaaaaaaaaaaaaaaaaa", "sha256": "aaaaaaaaaaaaaaaaaaaaaaaaaaaaaaaaaaaaaaaaaaaaaaaaaaaaaaaaaaaaaaaa"}]
  }
}
